"column_name_new","vars","n","mean","sd","median","trimmed","mad","min","max","range","skew","kurtosis","se","category_1","sub_category","constructs","constructs_type","weights","factor","metric","metric_type","description"
"num_sales_channel_livestock",70,199,0.517587939698492,0.680494629266003,0,0.403726708074534,0,0,3,3,1.13279633620838,0.755776933542677,0.0482389852795785,"P&I_context_value_chain","value chain",NA,NA,NA,"Livestock sales channel","number of channels","continuous","Number of different sales channels used for selling livestock."
"distance_crop_market",71,199,265.814070351759,258.915142689949,216,230.527950310559,231.2856,0,1272,1272,1.70456298044997,3.78208458712706,18.3540078344956,"physical_capital","distance","distance_crop_market","composite","mode_A","Distance to crop market","min","continuous","Distance to the closest crop market (in minutes)."
"distance_closest_farmland",72,199,14.6030150753769,77.8877604196362,0,5.24844720496894,0,0,1080,1080,12.8800473569239,172.94357904251,5.52131694616722,"physical_capital","distance","distance_farm","composite","mode_A","Distance to farmland","min","continuous","Distance to the closest farmland (in minutes)."
"distance_water_source",73,199,8.31155778894472,13.605310055359,2,5.3167701863354,2.9652,0,96,96,2.88043119015386,10.919699699412,0.964454858655489,"physical_capital","distance","distance_fresh_water_source","composite","mode_A","Distance to fresh water source","min","continuous","Distance to the closest fresh water source (in minutes)."
"distance_livestock_market",74,199,842.949748743719,1194.02773832365,420,600.975155279503,569.3184,0,4320,4320,1.75595532405315,1.6188187923396,84.642382195625,"physical_capital","distance","distance_livestock_market",NA,NA,"Distance to livestock market","min","continuous","Distance to the closest livestock market (in minutes)."
"distance_main_road",75,199,60.3266331658291,69.0594009005913,30,49.1490683229814,44.478,0,360,360,1.36225830632052,1.45056576851902,4.89549113275649,"physical_capital","distance","distance_main_road","composite","mode_A","Distance to main road","min","continuous","Distance to the closest accessible and functioning road suitable for cars (in minutes)."
"irrigated_land_percentage",76,199,1.01507537688442,6.02978917075751,0,0,0,0,50,50,6.27764520249102,40.1198096477823,0.42744042133128,"physical_capital","irrigation","irrigation","composite","mode_B","Irrigated land","percentage","continuous","Percentage of the household's land that is irrigated."
"num_info_exchange_farmers",77,199,10.1708542713568,10.0484158645901,8,8.85093167701863,8.8956,0,80,80,2.37325015963834,11.249442561001,0.712313314651554,"social_capital","Networks","communicate_with_other_farmers","composite","mode_B","Frequency of information exchange with other farmers","number of exchanges/year","continuous","How frequently does the farmer exchange information with other farmers?"
"num_membership",78,199,1.99497487437186,1.96817478754175,1,1.70186335403727,1.4826,0,11,11,1.94869124499857,5.21342921988594,0.139520211505962,"social_capital","Networks","network_membership","composite","mode_B","Number of association/organization memberships","number of institutions","continuous","Number of associations or organizations that the farmer or household members are part of."
"years_in_community",79,199,28.5979899497487,18.1778307642256,26,27.0931677018634,19.2738,2,80,78,0.704795411086361,-0.0134210336756282,1.28859225765819,"social_capital","Networks","years_in_community","composite","mode_A","Years in the community","years","continuous","How many years has the farmer lived in the community?"
